Title,Description,Lat,Lon,Link,ID
"Monster auction sale of valuable business & building sites, Petrie Terrace & Bishop's Hill, Petrie Terrace","Digitised as part of the 'Henzell and Cameron Estate Maps Project' 2005.;Plan of allotments to be sold Saturday 10th February, 1883.;Arthur Martin & Co., Auctioneer.;Hamilton & Raff, Surveyors.",-27.459566,153.012546,http://hdl.handle.net/10462/deriv/18291,996986024702061
Plan of Queen's Beach,"Plan of allotments to be sold.;Estate covers area now in Scarborough.;John Cameron, auctioneer; J. Jeays, surveyor; McNaught, Litho.;Cameron and Henzell no. 437QSL",-27.210736,153.116370,http://hdl.handle.net/10462/deriv/412004,997030564702061
Petrie Fruit Farm Blocks,Plan of allotments to be sold privately.;Estate covers area now in Kallangur.,-27.250409,152.985102,http://hdl.handle.net/10462/deriv/221026,996980224702061
The Bulimba Park Estate,"Plan of allotments, ""being the property of the Metropolitan Freehold Land & Building Company Limited, for sale on the ground on Saturday 12th November [1887] at 2.30 o'clock."" Includes terms of sale.;Map shows area either side of Mullens Street, between what is now Hawthorne Road and Riding Road.;Cameron and Henzell no. 818AQSL",-27.460696,153.062049,http://hdl.handle.net/10462/deriv/257053,996978654702061
The Eagle Farm and Sandgate Junction Township [Estate],"Plan of allotments ot be sold by auction on Saturday 30th June, 1888.;Estate covers area now in Clayfield.;Land for sale is resubdivisions of subdivisions 13 to 25 of allotment 4 of portion 5, Parish of Toombul.",-27.414007,153.057652,http://hdl.handle.net/10462/deriv/264204,996989504702061
"Melrose Fruit Farms, Aspley",Plan of allotments for private sale.;Estate covers area now in Carseldine.;Land for sale is subdivisions of portion 22. Parish of Kedron.,-27.356079,153.009306,http://hdl.handle.net/10462/deriv/257048,996978764702061
Plan of divisions of unsold land into 45 lots,"Plan of allotments to be sold.;Estate covers area now in Gumdale, Belmont and Chandler.",-27.48594,153.164724,http://hdl.handle.net/10462/deriv/257060,996978724702061
"Abbotsford Estate, right on the station, Enoggera","Plan of allotments to be sold 3rd December, 192-? .;Map badly torn along vertical centrefold, some small sections missing.;Land for sale is resubdivisions 1 to 32 & (Easement A) of subdivision 2 of resubdivision 2 of subdivision 3 of portion 406 & of subdivision 2 of portion 407. Enoggera.",-27.421695,152.990634,http://hdl.handle.net/10462/deriv/264232,996989544702061
"Plan of allotments in sections 4, 10, 11 & 12, town of Caloundra, and allotments in suburban sections 5, 6, 8, 9, 2a, 5a to 7a and 9a, Parish of Bribie (Caloundra)","Plan of allotments to be sold by auction, 7th January, 1908.;Copy 2 has bottom right-hand corner missing.",-26.782163;-26.7985;-26.800971,153.130238;153.132892;153.145294,http://hdl.handle.net/10462/deriv/264219,996989654702061
Wilston Estate,"Plan of allotments to be sold Saturday 10th September, -.;Estate covers area now mainly in Wilston, partly in the Grange.;Map is missing centre-right hand section.;Land for sale is part of section 1 & 2 of the Wilston Estate.",-27.432414,153.016624,http://hdl.handle.net/10462/deriv/264242,996989614702061
New Workshops Estate,"Plan of allotments to be sold on Saturday 1st March, 1902.;Estate covers area now in Raymonds Hill, Ipswich.;Library holds 2 copies, 1 original and 1 photograph (23 x 29 cm)",-27.589903,152.7623,http://hdl.handle.net/10462/deriv/280197,996989724702061
Lincoln Estate,,-27.455689,153.009446,http://hdl.handle.net/10462/deriv/280858,997060704702061
The Liverpool Estate,Estate covers area in Runcorn.;Land for sale is subs. 1 to 140 of portion 412 Parish of Yeerongpilly.,-27.600342,153.068381,http://hdl.handle.net/10462/deriv/280859,997060714702061
[Enoggera Estate] :,Plan of allotments.;Hand drawn in pencil.,-27.430842,153.03898,http://hdl.handle.net/10462/deriv/280885,997251124702061
"For sale, 20 farms, being part of the Jondaryan estate, Darling Downs, Queensland",,-27.329004,151.54232,http://hdl.handle.net/10462/deriv/280875,997269234702061
The marine township of Central Caloundra,"At head of title: Central Caloundra.;Plan of allotments to be sold. Map shows area around William Street, Caloundra.;Cameron and Henzell no. 436QSL",-26.793966,153.138895,http://hdl.handle.net/10462/deriv/411991,997030954702061
"[Stanley Hall Estate, Toombul]","Title from back of map.;Plan of allotments to be sold.;Land for sale is re-subdivisions 3 & 4 of portions 86 and 87. Parish of Toombul;Estate covers area now in Clayfield and Ascot. Shows properties adjoining Enderley Road, Florence Street, Graven Street and Alexandra Road.;Charlton, Elliott & Sons, auctioneers.;Surveyor: Harry Raff .;Map comprises centre section only of much larger map, with hand written notes",-27.425603,153.057663,http://hdl.handle.net/10462/deriv/280192,997041044702061
"Allendale, Bulimba",,-27.454099,153.062463,http://hdl.handle.net/10462/deriv/280870,997060684702061
Felton Estate,"Plan of allotments to be sold by auction on June 29, 1911.;Comprising about 34,500 acres.;Surveyor: Charlton, Yates and Jones.;Auctioneer: Australian Estates & Mortgage Co. Ltd.",-27.774149,151.751573,http://hdl.handle.net/10462/deriv/280877,997269764702061
Plan of the Logan Road Estate,"Plan of allotments to be sold on the ground, on Saturday, June 8.;Estate covers area in Greenslopes.",-27.502462,153.047002,http://hdl.handle.net/10462/deriv/280840,997060754702061
Goldicott Toowong,"Digitised as part of the 'Henzell and Cameron Estate Maps Project' 2005;""29 magnificent allotments and Goldicott House ... under the instructions from Mrs E. [Defree]. To be sold by public auction on the ground on Saturday 31st May, at 3 o'clock."";Map shows the residence and grounds [of] late Hon. W. H. Wilson and Toowong Station.;Isles, Love & Co., auctioneers .;H. Raff, Surveyor.",-27.485791,152.987513,http://hdl.handle.net/10462/deriv/18314,997031014702061
"Villa sites, Rosemount Estate.","Digitised as part of the 'Henzell and Cameron Estate Maps Project' 2005.;Plan of allotments to be sold on Saturday October 25th [1879].;J.R. Dickson, auctioneer; Cleghorn & Co, lithographers.;Estate covers area near Lyons Terrace, now in Windsor.;Cameron and Henzell no. 348AQSL.;""Oaklands the late residence of Sir James Cockle""",-27.437075,153.033130,http://hdl.handle.net/10462/comp/9720,997031034702061
Thompson estate,"Estate covers area in Annerley and Greenslopes.;For sale by J. B. Ellis.;[Buyers map] contains information ""Luncheon at 2 o'clock"" printed at each side of the map.",-27.502675,153.038947,http://hdl.handle.net/10462/deriv/280841,997060794702061
Plan of the Laurelbank Estate,"Plan of allotments to be sold by auction on Saturday, 19th October, 1889.;Estate covers area in Norman Park.;Auctioneer: G. T. Bell.",-27.474759,153.054807,http://hdl.handle.net/10462/deriv/280849,997071574702061
[Tracing of an estate near Nundah Railway Station],"Plan of allotments to be sold.;Signed by Min Teddy, Northgate.;Estate is in Wavell Heights.",-27.395294,153.04952,http://hdl.handle.net/10462/deriv/280888,997251164702061
View from Boyd estate,"Estate map showing land for sale by auction on June 2, [19--?] at Tumbulgum, N.S.W.;Auctioneer: W. H. Brett.",-28.17772,153.539866,http://hdl.handle.net/10462/deriv/280879,997269784702061
Plan of the Homewood Estate,,-27.496523,153.057105,http://hdl.handle.net/10462/deriv/280865,997060614702061
"Plan of part of Grenier's Estate, South Brisbane",Digitised as part of the 'Henzell and Cameron Estate Maps Project' 2005;Plan of allotments to be sold.;Estate covers area now in Highgate Hill and West End.;Hand drawn in pencil.,-27.482176,153.012859,http://hdl.handle.net/10462/deriv/18323,997031194702061
"Plan of the Sylvan Grove Estate, Toowong, being subdivisions 1 to 28 part of portion 256, Enoggera","Plan of allotments to be sold by public auction on Monday, May 27, [188-?]",-27.485194,152.99257,http://hdl.handle.net/10462/deriv/280855,997060464702061
Alderley Park,"Plan of allotments to be sold on Saturday, 19th April, 1890.;Shows proposed railway line.;G. K. Jopp, surveyor.",-27.424977,153.004132,http://hdl.handle.net/10462/deriv/280195,997060424702061
City property,"Plan of allotments to be sold on Monday, September 18, 1865.;Auctioneer: Arthur Martin.",-27.470827,153.036637,http://hdl.handle.net/10462/deriv/18688,997060434702061
Oxley Station Terraces Estate,"Plan of allotments to be sold on Saturday 15th June, 1889.;Auctioneers: T. A. Lawson & Co.",-27.546533,152.974137,http://hdl.handle.net/10462/deriv/280216,997060474702061
"Sub. 1, port. 28, parish of Yeerongpelly, at Runcorn st.n.","Description on map is hand written.;Plan of allotments to be sold.;Land agents: Pike, Dietrichson & Co.",-27.600057,153.07074,http://hdl.handle.net/10462/deriv/280174,997031164702061
Sherwood Station Estate,"Plan of allotments to be sold by public auction on the ground on Saturday, March 17, 1928.;Digitisation of this Real Estate map was made possible with the generous support of the Queensland Library Foundation Legacy Partners.;Land for sale is subdivisions 1-13 of resubdivisions C & D of subdivision 2 of resubdivisions 5 & 6 of resubdivisions 3 & 4 of subdivision 3 of portion 94 & 94a, Parish of Oxley.",-27.530773,152.978595,http://hdl.handle.net/10462/deriv/280868,997060654702061
Plan of the Grand View Estate,"Plan of allotments to be sold by auction on the ground on Saturday, February 1st.",-27.500826,153.026364,http://hdl.handle.net/10462/deriv/280864,997060604702061
Sherwood Station Estate,"Plan of allotments for private sale.;Digitisation of this Real Estate map was made possible with the generous support of the Queensland Library Foundation Legacy Partners.;Land agent: Herbert Hoare.;Land for sale is subdivisions 1-13 of resubdivisions C & D of subdivision 2 of resubdivisions 5 & 6 of resubdivisions 3 & 4 of subdivision 3 of portion 94 & 94a, Parish of Oxley.",-27.530773,152.978595,http://hdl.handle.net/10462/deriv/280867,997060644702061
Realisation of valuable city freeholds,"Plan of Sub A of Allotment 4 & Subd & Resubd of Sub 3 of [Allotment] 4 and Allot. 15 of Section 10. Parish of Nth Brisbane.;Plan of allotments to be sold in the Post Office Auction Mart Monday 13th June, 1927.;""By order of J.P. Macfarlane Esq. in the matter of Alexander Stewart & Sons Ltd., in liquidation.""",-27.468851,153.025644,http://hdl.handle.net/10462/comp/3676,997251134702061
"Plan of re-subdivision of portions 86, 87, Parish of Toombul, County of Stanley",Plan of allotments to be sold.,-27.405612,153.057437,http://hdl.handle.net/10462/deriv/280213,997030764702061
"Plan of Waterford Estate, being sub-division of portions 133 & 134 into 50 valuable city building allotments, Parish of South Brisbane, County of Stanley",Relief shown by hachures.;Estate covers area in South Brisbane.,-27.48461,153.029268,http://hdl.handle.net/10462/deriv/18689,997061084702061
Plan of the Norman Estate,Plan of allotments to be sold.;Estate covers area probably in Wooloongabba or neighbouring suburbs.,-27.496235,153.042387,http://hdl.handle.net/10462/deriv/280199,997036564702061
"Plan of portions no.s 830b, 865, 866, 866a, 867, 867a & 868 to 872, Parish of Enoggera, County of Stanley, District of Moreton",Plan of allotments.;Estate covers area in Bardon.,-27.464895,152.979401,http://hdl.handle.net/10462/deriv/280191,997041034702061
"Plan of the Parkhill Estate, German Station","Plan of allotments to be sold 24th June, 1882.;John Cameron, auctioneer; McKellar,  Lithographer.;Estate covers area now in Nundah.;Cameron and Henzell no. 310QSL",-27.397500,153.060256,http://hdl.handle.net/10462/deriv/411995,997030984702061
"Plan of sections nos. 1 to 7, Town of Burleigh, Parish of Mudgeeraba, County of Ward",Plan of allotments.;Relief shown by hachures,-28.091078,153.45259,http://hdl.handle.net/10462/deriv/280189,997040974702061
The Erneton Estate,"Plan of allotments to be sold by public auction on the ground, Saturday 16th of April.;Estate covers area in Newmarket.;Land for sale is subdivisions 1-206 of re-sub B of sub 2 of por. 271, County of Stanley, Parish of Enoggera.",-27.433237,153.008511,http://hdl.handle.net/10462/deriv/280857,997060694702061
"The Isle of Man Estate, Deception Bay",,-27.196946,153.035999,http://hdl.handle.net/10462/deriv/221031,997060944702061
Alexandra Headland,"Notice of an application to erect a residential hotel on Alexandra Headland, Maroochydore, by Thomas O'Connor.;Architect: T.R. Hall.",-26.675501,153.113727,http://hdl.handle.net/10462/deriv/280876,997269754702061
Sparkling Wave Estate,"Digitised as part of the 'Henzell and Cameron Estate Maps Project' 2005;John Cameron, auctioneer.;Includes sketch.",-27.970861,153.412821,http://hdl.handle.net/10462/deriv/18341,997031964702061
Ballan Estate,Plan of allotments to be sold.;Shows streets (some named);Estate covers area in Woolloongabba.;Auctioneer: Arthur Martin.,-27.487264,153.03413,http://hdl.handle.net/10462/deriv/280847,997071474702061
"Parry-Okeden Estate, Margate Beach Redcliffe","Plan of allotments to be sold by auction on Monday, New Year's Day, 2nd January 1933.;Land for sale is subdivisions of resubdivision 2 of subdivision 5 of portions 187 & 188, Parish of Redcliffe.;Library copy is a reproduction.",-27.238556,153.110155,http://hdl.handle.net/10462/deriv/280871,997224214702061
Sub 4 1/42 Sect. 9 [Coorparoo],Plan of allotments.;Hand drawn in pencil.,-27.490212,153.05867,http://hdl.handle.net/10462/deriv/280889,997251174702061
First section of Norman Park,"Estate map for land sale on Saturday, March 12, [19--?];Auctioneer: K. J. Gottell.;Surveyor: G. K. Jopp.",-27.475311,153.059822,http://hdl.handle.net/10462/deriv/280880,997269794702061
"Plan of the Primrose Estate, comprising portions 117 & 125, Parish of North Brisbane","Estate covers area in Fortitude Valley.;Auctioneer: J. B. Ellis & Co.;E. MacDonnell, licensed surveyor.",-27.4922,152.983243,http://hdl.handle.net/10462/deriv/280203,997061114702061
Stafford Heights estate,"Plan of allotments to be sold by public auction on Saturday, 24th Nov. 1951.;Auctioneers: A.V. Postle & Co.",-27.405287,153.012421,http://hdl.handle.net/10462/comp/3673,997222334702061
"Suburban sections 1 to 2, North Brisbane, County of Stanley, District of E. Moreton, Queensland /","Plan of allotments.;Cat no. B 3 151.;Map shows an area in Kelvin Grove, bordering Kelvin Grove Road and Victoria Park.;Cameron and Henzell no. 301QSL",-27.452252,153.012718,http://hdl.handle.net/10462/deriv/436446,997030694702061
"St. Leonards Estate being re-subs. 81 to 107 of subs. 118 to 129, and 108 to 128 of subs. 52, 53, 57, 58 & 64 to 66 of por.ns 108 & 109, Parish of Redcliffe","Plan of allotments to be auctioned on Saturday, 6th Dec., 1890.;Estate covers area in Woody Point.;G. C. Hamilton, surveyor.;... Ham, Auctioneers.",-27.259507,153.106528,http://hdl.handle.net/10462/deriv/280206,997061154702061
"Plan of western suburban allotment 72, [Parish of] South Brisbane",Plan of allotments to be sold.;Estate covers area now in West End.;Hand drawn in ink.,-27.481936,153.007812,http://hdl.handle.net/10462/deriv/280214,997031274702061
"Plan of the town of Sandgate, Parish of Nundah, County of Stanley, Queensland","Map shows railway lines and terminus, swamp areas, lagoons, recreation reserves, and streets (some named)",-27.322284,153.073765,http://hdl.handle.net/10462/deriv/280181,997060524702061
Avondale estate,"""W. E. Curtis, auctioneer (in conjunction with G. T. Bell government auctioneer, Brisbane) has been instructed by the owners Messrs Brown & Johnston to sell by public auction at his rooms, Bundaberg, Saturday Sept. 26th, 1891 subs. of por. 5, 9 & 10, Parish of Yandaran, County of Cook, Q'land, and 100 quarter-acre lots, and some garden lots, in same por. & farms 25 & 45 acres each.""",-24.720617,152.164014,http://hdl.handle.net/10462/deriv/280861,997060534702061
The Blackheath Estate,"Plan of allotments to be sold by auction on the ground on Saturday, June 14th.;Auctioneers: E. Hooker & Son.",-27.426031,153.032008,http://hdl.handle.net/10462/deriv/280862,997060544702061
Plan of Mayfield,"Plan of allotments 'for sale by John Cameron, Town Hall, Brisbane'.;Estate covers area now in Bulimba.;Auctioneer: John Cameron; Warwick & Sapsford (lithographer);Cameron and Henzell no. 272QSL",-27.444661,153.063489,http://hdl.handle.net/10462/deriv/411996,997031244702061
"Plan of 108 allotments in the Hayes Inlet Estate, Humpy Bong, county of Stanley, parish of Redcliffe","'To be sold by auction by Mr John Cameron, on Monday the 7th March.';A. Muir, lithographer.;Estate covers area probably in Clontarf. Map shows Clifton Terrace, Redcliffe Street and Bayfield Street.;Cameron and Henzell no. 271QSL;Auctioneer: John Cameron.",-27.250345,153.079585,http://hdl.handle.net/10462/deriv/411997,997031254702061
"Plan of the Rosebank Estate situated between Montague Road and the Brisbane River, close to Mr. Munroe's villas, South Brisbane",,-27.472867,153.0126,http://hdl.handle.net/10462/deriv/280856,997060504702061
The Central Woolloongabba Estate,"Plan of allotments to be sold by public auction on the ground on Saturday, 4th August, 1900.",-27.482494,153.040044,http://hdl.handle.net/10462/deriv/280863,997060554702061
Subdivisional sale of Brisbane city freeholds,"Digitised as part of the 'Henzell and Cameron Estate Maps Project' 2005;At the Post Office Auction Mart, Monday at 11 o'clock 3rd August, 1908.;Estate covers area around Queen, Eagle, Wharf and Adelaide Streets.;Land for sale is subs. 9 to 21 of subs. 12 to 15 of sec. 51, parish of North Brisbane.;Auctioneers: Isles, Love & Co.;H. Raff lic. Surveyor, Central Chambers, Queen St.",-27.464733,153.030742,http://hdl.handle.net/10462/deriv/18329,997031264702061
"[Plan of Township of Moondarewa, Stradbroke Island, County of Stanley, Parish of Currigee]",Digitised as part of the 'Henzell and Cameron Estate Maps Project' 2005;Plan of allotments to be sold.;Title added to base map by hand.,-27.888981,153.419749,http://hdl.handle.net/10462/deriv/18326,997031214702061
Nudgee farms,Plan of allotments to be sold.;Auctioneer: B. F. Canniffe.;Library holds 2nd copy - is photocopy.;Land for sale is subdivisions 1 to 7 of portions 284 to 286 & 288 and subdivisions 1 to 4 of portions 271 & 272. Parish of Toombul.,-27.373419,153.098258,http://hdl.handle.net/10462/deriv/280850,997078764702061
"Plan of subdivision of allotments 7 & 8 of section 1, Town of Southport",Plan of allotments to be sold.,-27.967015,153.412217,http://hdl.handle.net/10462/deriv/287209,997030754702061
Southport North,"'Portion 62 , Parish of Barrow'? - hand written on map.;Plan of allotments to be sold 'Sales (through J.C. ...?',  [5th August, 1883?] - hand written on map.;Estate covers area in Biggera Waters and Labrador, Southport.;Cameron and Henzell no. 318.QSL",-27.933040,153.405035,http://hdl.handle.net/10462/deriv/411990,997030734702061
"Plan of subdivisions 1 to 32 of portion 73, town of Sandgate","Digitised as part of the 'Henzell and Cameron Estate Maps Project' 2005;""For sale. apply to Wm. [William] Potts, Queen Street, Brisbane"" - on map.;Estate covers area in Sandgate and/or Brighton.",-27.321678,153.070475,http://hdl.handle.net/10462/deriv/18308,997030774702061
"Plan of the Henderson Estate, Parish of Indooroopilly, subdivisions of part of portion 45","Plan of allotments to be sold by auction on Monday, June 3, 1878.;Estate covers area in Taringa.;Auctioneer: John Cameron.",-27.49224,152.983243,http://hdl.handle.net/10462/deriv/280201,997061074702061
"For sale at the Mart., 121 Queen St., Monday May 6 at 12 o'clock, 8 splendid allotments 8 on Ipswich Road, near Junction Hotel, and opposite Stephen's Divisional Board Office","Land for sale is re-subdivisions 1 to 8 of subdivisions 43 to 46 portion 173a, Parish of Yeerongpilly.",-27.508031,153.033645,http://hdl.handle.net/10462/deriv/282093,997225194702061
Newtown estate,Plan of the unsold allotments ... for sale on Saturday Sep. 17 .;Digitisation of this Real Estate map was made possible with the generous support of the Queensland Library Foundation Legacy Partners.,-27.497915,152.979287,http://hdl.handle.net/10462/deriv/282094,997225204702061
Markwell's Paddock,"At foot of title: Plan of Markwell's Paddock, Mayne, the property of Federal Building, land and Investment Society, Limited, comprising 248 allotments, for sale on the ground on Saturday afternoon, September 7, 1889, at 2.30 p.m.",-27.436188,153.041374,http://hdl.handle.net/10462/deriv/282089,997225224702061
Plan of the East Stratton Estate,Shows streets (some named);Estate covers area in Newstead and Fortitude Valley.;Hand drawn in lead pencil.,-27.452233,153.042743,http://hdl.handle.net/10462/deriv/280846,997071464702061
"Plan of Waterford Estate, South Brisbane, por'n 132",Hand drawn in ink.,-27.483276,153.021632,http://hdl.handle.net/10462/deriv/280843,997060844702061
Plan of the Breakfast Creek Estate,"Digitised as part of the 'Henzell and Cameron Estate Maps Project' 2005;John Cameron, auctioneer.;J. Jeays, licensed surveyor.;Includes local sketch.",,,http://hdl.handle.net/10462/deriv/18338,997031934702061
"Plan of the Bristol Estate, parish of Enoggera, county of Stanley","Plan of allotments to be sold.;Estate covers area probably in Ashgrove, or Red Hill.;Land agents: J. Barger & Co. .;Bottom right hand corner missing",-27.445051,152.993909,http://hdl.handle.net/10462/deriv/280179,997040964702061
"Plan of part of sections 1 & 9 & sections 10 & 11, town of Southport, Parish of Nerang, County of Ward, District of E. Moreton, Queensland",Plan of allotments.,-27.971639,153.412238,http://hdl.handle.net/10462/deriv/18687,997040984702061
"Parish of Drayton, Parish of Eton Vale",Plan of allotments.;Photolithographed at the Lands Department Brisbane by George Fairman.,-27.582618,151.933397,http://hdl.handle.net/10462/deriv/280198 SLQ.,997031914702061
"Plan of 43 splendid building sites, in the Haughton Estate, Windsor Road,","Plan of allotments to be sold 10th June, -.;Estate covers area now in Red Hill.;Library holds 2 copies, one missing the top section (Blue line, with R. J. Cottell as Auctioneer), the other with name of auctioneer added by hand: John Cameron",-27.447044,153.003348,http://hdl.handle.net/10462/deriv/280212,997030714702061
"Plan of 117 splendid allotments in the Humpy Bong township, being portions 125 and 126, County of Stanley, Parish of Redcliffe","Plan of allotments to be sold.;Estate covers area in Woody Point.;Library's copies have handwriting on the recto;John Cameron, Auctioneer.;W.F. Bishop, Surveyor.",-27.253272,153.099545,http://hdl.handle.net/10462/deriv/280202,997061094702061
"The Vaughan Estate, being portion 22, North Pine River, Parish of Redcliffe",Plan of allotments to be sold.;Library's copy has area shaded in purple ink,-27.201466,153.023242,http://hdl.handle.net/10462/deriv/280204,997061124702061
The Morayfield Railway Station Estate,"Plan of allotments to be sold.;""Containing town lots, as in blocks A & E, suburban lots, 3 acres and under, small farms. All within five to fifteen minutes walk of the railway station at South Caboolture.""",-27.09312,152.939534,http://hdl.handle.net/10462/deriv/221030,997060934702061
"Plan of building sites, Corunna Estate, portion 149, Enoggera","Plan of allotments to be sold 27th September, 1880.;Estate covers area now in Albion.;Auctioneer: John Cameron.",-27.430767,153.039882,http://hdl.handle.net/10462/deriv/18685,997040914702061
Plan of the town of Southport,,-27.967299,153.414062,http://hdl.handle.net/10462/deriv/280215,997060454702061
Plan of Lower Brisbane,"Plan of allotments to be sold.;Estate covers the area now in Bulimba. Map shows the area between Brisbane Street and Government Road (now Oxford Street), from Brisbane River, showing the site of the Bulimba ferry terminal, west towards what is now Lytton Road. Also shows the site of Bulimba House and a church (probably what is now the Bulimba Uniting Church).;Simon Fraser, auctioneer.;Cameron and Henzell no. 332QSL",-27.449555,153.057693,http://hdl.handle.net/10462/deriv/411998,997031904702061
Port Hacking Seymour Estate,"Plan of allotments to be sold by auction on the ground, Saturday, 9th April, 1927.;Auctioneers: C. Monro Ltd., Sydney, P. J. B. Mansell, Marrickville, and Monro & Buist, Cronulla.",-34.061517,151.129185,http://hdl.handle.net/10462/deriv/280866,997060634702061
Taringa Township,"Plan of allotments to be sold on the ground Saturday, 19th March.",-27.491762,152.9836,http://hdl.handle.net/10462/deriv/280869,997060664702061
"Plan of the Thompson Estate, Wooloongabba",Auctioneer: J. B. Ellis.;Library's copy has area shaded in brown ink;Estate covers area in Annerley and Greenslopes.,-27.502675,153.038947,http://hdl.handle.net/10462/deriv/280180,997060494702061
"Town of Cleveland, County of Stanley known as the Old Police Paddock & being sections 116, 116A, 116B, 117, 117A, & 117B","Plan of allotments to be sold on Saturday, 26th October 1889 .;Auctioneer: G. T. Bell.",-27.532877,153.280013,http://hdl.handle.net/10462/deriv/280193,997060404702061
"The marine township of Scarborough, Parish of Redcliffe, Humpy Bong, Moreton Bay","Shows named streets, hotel grounds, and positions for water and recreation reserves .",-27.201945,153.113204,http://hdl.handle.net/10462/deriv/280194,997060414702061
Nindooimbah Estate,"'Supplement to the Daily mail, Brisbane, Saturday, March 31st, 1906'.",-28.048702,153.047603,http://hdl.handle.net/10462/comp/3674,997224794702061
Township of Southport,Plan of allotments to be sold.,-27.968228,153.411595,http://hdl.handle.net/10462/deriv/18684,997030744702061
