Title,Description,Lat,Lon,Link,ID
"Plan of the Windsor Park Estate, Lutwyche.","Plan of allotments to be sold Saturday August 4th [1888]. Includes terms of sale.;W.J. Hooker, auctioneer; Hamilton & Raff, surveyors; Muir & Morcom, litho.;Map shows an area of '69 allotments' close to Isedale St. (possibly on Wellington St.) on the border of what is now Lutwyche and Wooloowin.;Cameron and Henzell no. 854QSL",-27.420828,153.038107,http://hdl.handle.net/10462/deriv/398709,99183306719202061
Norman Park :,"'Property of the Queensland Deposit Bank.';Plan of allotments to be sold 'on the ground, Saturday, September 15, 1888'. Includes terms of sale. 'Subdivisions of Block B of Portions 8a, 9a, 10a and 129, Parish of Bulimba.';R.J. Cottell in conjunction with Arthur Martin & Co., auctioneers; G.K. Jopp, surveyors.;Map shows an area of Norman Park, including Wordsworth St., Norman Avenue and Thackeray St., bordering Norman Creek.;Cameron and Henzell no. 830QSL",-27.479216,153.058491,http://hdl.handle.net/10462/deriv/398720,99183306213402061
Plan of Queen's Park and Rose Bank Estates.,"Plan of allotments to be sold by auction 14th Sept. 1889. Includes terms of sale.;Arthur Martin & Co. Ltd., auctioneers; Hamilton & Raff, surveyors; Warwick & Sapsford [lithographers];Map shows area in Coorparoo bordering Old Cleveland Road and including what is now Wellington St., Shakespeare St. and Nicklin St.;Cameron and Henzell no. 829QSL",-27.499000,153.056271,http://hdl.handle.net/10462/deriv/398722,99183306218702061
Valentine's homestead :,"Plan of allotments to be sold. 'Easy terms.';C. Fletcher, auctioneer.;Map shows a small area on Mount Cotton Road, possibly near Tingalpa Creek, in Burbank. It is undated.;Cameron and Henzell no. 933QSL",-27.560207,153.185141,http://hdl.handle.net/10462/deriv/411132,99183312716702061
The Woodlands Estate :,"Plan of allotments to be sold by auction 20th October, 1888. Includes terms of sale.;Arthur Martin & Co. Ltd., auctioneers; Watson Ferguson & Co. Ltih.; G.G. McLennan, surveyor.;Map shows area of Bulimba St., between Brisbane St and the Brisbane River in Bulimba.;Cameron and Henzell no. 849QSL",-27.444947,153.056708,http://hdl.handle.net/10462/deriv/398711,99183306720502061
Redland Bay Estate.,"Plan of allotments to be sold by auction on 18th March, 1889.;At head of title: 109 grand marine sites.;A. Martin & Co. Ltd., auctioneers; Warwick & Sapsford [lithographer].;Map shows area along the Esplanade at Redland Bay.;Cameron and Henzell no. 1014QSL",-27.612017,153.300680,http://hdl.handle.net/10462/deriv/411238,99183312716102061
Fairy Knowe :,"Plan of allotments to be sold 13th July 1912. Includes terms of sale.;Isles, Love & Co., auctioneers; H.T. James, draftsman; R.A. Hamilton, surveyor.;Map shows an area near bordered by  Rosslyn St., Lomond Terrace and Vulture Street East in East Brisbane.;Cameron and Henzell no. 852QSL",-27.485266,153.044379,http://hdl.handle.net/10462/deriv/398710,99183306719802061
"Holmedale Estate, Milton :","Plan of allotments to be sold March 14, [1885]. Includes terms of sale.;John W. Todd, auctioneer.;Map shows area of Prince Street, between Fernberg Road and Latrobe Terrace, now known as Paddington, Brisbane.;Cameron and Henzell no. 472QSL",-27.460243,152.994353,http://hdl.handle.net/10462/deriv/389671,99183294021102061
Ardentallen,"""The pick of Enoggera, 200 choice residential sites, only 260 yards from Enoggera station, easy 3 minutes walk"";""Being subs of portions 408 & 409 Parish of Enoggera"";""Under instructions from Mr James Ferguson.;Isles, Love & Co., auctioneers.;Includes local sketch.;Andrew Paterson, authorised surveyor.;Map on verso of sheet, description of land, public transport and utilities available on recto.",-27.423395,152.989169,http://hdl.handle.net/10462/comp/3782,9912338974702061
Manly Beach :,"Plan of allotments to be sold by auction [1885]. Includes terms of sale.;James R. Dickson & Co., auctioneers; R.D. Graham & Son, surveyors; Warwick & Sapsford, litho.;Map shows area near the coast between Gordon Parade and Cardigan Parade and Mountjoy Terrace, Manly.;Cameron and Henzell no. 822QSL",-27.451468,153.183984,http://hdl.handle.net/10462/deriv/389680,99183294620802061
"Merthyr Estate, New Farm.","Plan of allotments to be sold 29 November 1919.;Cameron Bros., auctioneers; H.T. James, lithographers; Harry Raff, surveyor.;Map shows '24 charming river frontages' along the Brisbane River on Griffith Street, between Merthyr Road and Sydney Street, New Farm.;Cameron and Henzell no. 1986QSL;Includes terms of sale and illustration of 'Merthyr, the residence of Sir Samuel Griffith'.",-27.472976,153.042029,http://hdl.handle.net/10462/deriv/411134,99183313403302061
East Indooroopilly Estate :,"Plan of allotments in Indooroopilly. Possibly an area between Swann Road and Lambert Road near the current site of Indooroopilly State High School.;[Auctioneer, George Harden?];Cameron and Henzell no. 822QSL",-27.500372,152.983890,http://hdl.handle.net/10462/deriv/398714,99183305521102061
Gordon Park :,"Plan of allotments to be sold 8th December 1923.;'Being resubs of Sub 5 of Por 8, Parish of Kedron'.;Cameron Bros., Auctioneer; H.T. James, Lithographer; F.J. Charlton, Surveyor.;Map shows area near Aberdeen Terrace in Gordon Park.;Cameron and Henzell no.1988QSL",-27.418041,153.024321,http://hdl.handle.net/10462/deriv/410767,99183316918802061
"[Survey of Portions no. 64 and 65, County of Stanley, Parish of Indooroopilly]","Title constructed from survey information in lower right corner of map.;Map signed on verso by Joseph Joshua Jeays, surveyor, 1884.;Survey map showing area in Indoorooopilly, possibly near intersection of Witton Road and Moggill Road.;Cameron and Henzell no. 480QSL",-27.506705,152.960870,http://hdl.handle.net/10462/deriv/389678,99183294421102061
Plan of the Isedale Estate Lutwyche.,"Plan of allotments to be sold by auction Dec. 15th, 1888. Includes terms of sale.;'The property of the Imperial Deposit Bank, Building and Investment Company Limited.';G.T. Bell, auctioneer; Hamilton & Raff, surveyors; Watson Ferguson & Co. Litho.;Map shows area of Isedale St. on the border of Lutwyche and Wooloowin, Brisbane. 'Sub'n of Part 1 of Portions 192 & 195, Parish of Enoggera'. All printing and shading in red ink.;Cameron and Henzell no. 828QSL",-27.419182,153.037753,http://hdl.handle.net/10462/deriv/398724,99183306219702061
"The Adams Estate, Newmarket","Land for sale is subdivision 1 to 53 etc. of portions 272 & 273. Parish of Enogerra.;""53 very choice building sites"";Harry Raff, auth. surveyor.;Isles, Love & Co., auctioneers.",-27.430723,153.00995,http://hdl.handle.net/10462/deriv/282133,9912339614702061
"Brighton Heights, Sandgate.","Plan of allotments to be sold November 29, 1919.;'Being subs of resub 1 of sub A of por. 62, Parish of Nundah';Isles, Love & Co., auctioneers; H.T. James, lithographer; Harry Raff, surveyor.;Map shows allotments on Sutton Avenue and Brighton Road.;Cameron and Henzell no. 1982QSL",-27.304749,153.062688,http://hdl.handle.net/10462/deriv/411145,99183313404802061
Durundur repurchased estate,"At top of map: Mount Kilcoy.;""To be open for selection at the Court House Woodford on and after Tuesday 21st October 1902 at 11 o'clock forenoon"";""C. H. Baird, Licd. Surveyor"";""Surveyed into 38 portions area 18,020 a. 3r. 10p."";Relief shown by hachures and spot heights.;Land for sale is portions 222 to 237, 237a & 238 to 258 Parish of Kilcoy, County of Canning, Brisbane Land Agent's District, Caboolture Division",-26.790643,152.575847,http://hdl.handle.net/10462/deriv/209456,9912117644702061
"Baldwin Estate, Bulimba.","Plan of allotments to be sold by auction 7th May 1921.;'Being Resubs 30 to 35 of Sub H of Por. 31 and Subs of Resub 6 of Sub F of Pors. 10 & 31, Parish of Bulimba';Cameron Bros., auctioneers; R.A. Hamilton & James, surveyors; H.T. James, lithographer.;Map shows allotments along Baldwin Street, Bulimba.;Cameron and Henzell no. 2059QSL",-27.448850,153.065252,http://hdl.handle.net/10462/deriv/410758,99183318017802061
Molonga Estate.,"Plan of allotments to be sold by auction 7th February 1920.;'Being Subs of Resub 51 of Sub 2 of Resub 3 of Sub 1 of Por. 18 & of Sub 6 of Por. 20, Parish of Oxley';Cameron Bros., auctioneers; H.T. James, lithographer; Thor H. Jensen, surveyor.;Map shows area near Molonga Terrace, Graceville.;Cameron and Henzell no.1995QSL",-27.521533,152.972056,http://hdl.handle.net/10462/deriv/410762,99183316912502061
Plan of the Croydon Estate on the main Sandgate line.,"'Being subdivisions and re-subdivisions 1 to 362 of Portions 202 and 203; and Subdivision A of Portion 201, Parish of Toombul.';Plan of allotments to be sold by auction January 21, [1888]. Includes terms of sale.;James R. Dickson & Company, auctioneers; G.G. McLennan, surveyor; Gordon and Gotch, litho.;Map shows area near Royal Parade, now in Banyo.;Cameron and Henzell no. 800QSL",-27.375070,153.079054,http://hdl.handle.net/10462/deriv/389696,99183294420402061
Annerley Road :,"Plan of allotments to be sold by auction June 17 1922.;'Being Subs 1 to 5 of ReSubs 1 & 2 of Subs 11 & 12 & of Sub 13 of Portion 210, Parish of South Brisbane.';Cameron Bros., auctioneers; R.A. Hamilton & James, surveyors; H.T. James, lithographer.;Map shows allotments along Annerley Road near the intersection of Stephens Road, Woolloongabba.;Cameron and Henzell no. 2079QSL",-27.489795,153.028103,http://hdl.handle.net/10462/deriv/420917,99183319799902061
Gaythorne & Rangeview Estates.,"Plan of allotments to be sold at auction on Saturday 16th April 1921.;'Being subs of Pors. 393, 394 & 403, Parish of Enoggera'.;Cameron Bros., auctioneers; H.T. James, lithographer; R.A. Hamilton & James, surveyors.;Map shows area near Grays Road Gaythorne.;Cameron and Henzell no.2051QSL",-27.420540,152.979883,http://hdl.handle.net/10462/deriv/410769,99183317520302061
East Woolloongabba (Darragh's Paddock),"Plan of allotments to be sold by auction August 14th, 1886. Includes terms of sale.;Hamilton & Raff, surveyors; Arthur Martin & Co. auctioneers; Watson, Ferguson & Co. Litho.;Map shows area around Stanley Street near Norman Creek, East Brisbane.;Cameron and Henzell no. 488QSL",-27.486577,153.047602,http://hdl.handle.net/10462/deriv/389675,99183294420702061
Bulimba Hill Estate :,"Plan of allotments to be sold by auction December 20th, 1890. Includes terms of sale.;G.T. Bell, auctioneer; G. K. Jopp, surveyor; Watson Ferguson & Co. Lith.;Map shows area near the Brisbane River and Shakespeare St. in Bulimba.;Cameron and Henzell no. 826QSL",-27.446113,153.063115,http://hdl.handle.net/10462/deriv/398717,99183305917602061
Caloundra Heads Estate :,"Plan of allotments for private sale [1919?];Cameron Bros. Brisbane acting in conjunction with E. Bostock & Sons, Ipswich, auctioneers; H.T. James lithographer.;Map shows allotments along King Street near Shelly Beach in Caloundra.;Cameron and Henzell no. 1998QSL",-26.800102,153.148084,http://hdl.handle.net/10462/deriv/410753,99183317520902061
Graceville Park.,"Plan of allotments to be sold by auction Saturday 26th Oct. 1889.;R.J. Cottell, auctioneer; Gordon and Gotch, Lithographer.;Map shows area 'being re-subdivisions 1 to 227 of sub. 2 of Por. 17, County of Stanley, Parish of Oxley'. The allotments are on White Street and what is now Sandon Street, between Graceville railway station and the Brisbane River.;Cameron and Henzell no. 927 and 927AQSL",-27.520292,152.982686,http://hdl.handle.net/10462/deriv/398707,99183306718302061
Bulimba Hill Estate :,"Plan of allotments to be sold by auction April 13th, 1889. Includes terms of sale.;G.T. Bell, auctioneer; G.K. Jopp, surveyor; Watson, Ferguson & Co. Lith.;Map shows area near the Brisbane River and Shakespeare St. in Bulimba.;Cameron and Henzell no. 826AQSL",-27.446113,153.063115,http://hdl.handle.net/10462/deriv/398716,99183305917402061
The Range,"Plan of allotments to be sold [1924];'Being subs of Pors. 140, 824 & 679, Parish of Enoggera.;Cameron Bros., auctioneer; H.T. James, lithographer; R.A. Hamilton & James, surveyors.;Map shows allotments on what was Coronation Drive, now Sir Samuel Griffith Drive near The Summit of Mt Coot-tha.;Cameron and Henzell no.1999QSL",-27.463399,152.947433,http://hdl.handle.net/10462/deriv/410752,99183317520502061
The Blantyre Estate :,"Plan of allotments to be sold by auction 20th June, 1891.;'Being subs ... Parish of portion 259, Parish of Bulimba';G.T. Bell, auctioneer; Watson, Ferguson & Co. lithographer.;Map shows area where Cavendish Road meets Creek Road in what is now Mount Gravatt East.;Cameron and Henzell no. 1038QSL",-27.530912,153.094107,http://hdl.handle.net/10462/deriv/411169,99183313409702061
Sea View Estate :,"Plan of allotments to be sold by auction, August 9th [1884].;John W. Todd, auctioneer.;Map shows area originally advertised as being in Nundah, now possibly in Wavell Heights.;Cameron and Henzell no. 490QSL",-27.390619,153.058317,http://hdl.handle.net/10462/deriv/389672,99183294420502061
"Gilbert Estate, Yeronga.","Plan of allotments to be sold by auction Saturday 20th November 1920 under instructions from the Queensland Public Trustees Ltd. Trustees of the late Eli Gilbert.;'Being subs 1 to 17 of ReSub 1of Subs 1 to 12 of Sec 2 of Por. 166A,Parish of Yeerongpilly'.;A.M. Newman, auctioneer; J. Wynne Townson, surveyor; H.T. James, lithographer.;Map shows area near Cowper Street and Fairfield Road, Yeronga.;Cameron and Henzell no. 2057QSL",-27.518088,153.015939,http://hdl.handle.net/10462/deriv/410760,99183318019902061
The Cecil Plains Estate,"Below map: Por. 199 Parish of Cecil Plains, Por 253. Parish of St. Ruth, County of Aubigny, Toowoomba LAD. Shires of Jondaryan and Pittsworth. J.S. Parkinson Auth. Surveyor.;The estate map shows portions 199 and 253 in detail and includes local sketch of portions for selection. Scale 1:126,720. 2 miles to an inch.;Includes conditions attached to the perpetual lease selection and fee schedule.;Below schedule: Gov. Gaz., 18th December, 1954, page 2058.",-27.532492,151.226453,http://hdl.handle.net/10462/deriv/286404,9912590594702061
Lancaster's Gardens :,"'Being re subs of Sub 2 of allotment 15, Parish of Toombul. Includes terms of sale.;Arthur Martin & Co. Limited, auctioneers; Warwick & Sapsford, litho.; G.K. Jopp, surveyor.;Map shows area of Lancaster Road, between Racecourse Road and Nudgee Road in Ascot.;Cameron and Henzell no. 814QSL",-27.432667,153.068460,http://hdl.handle.net/10462/deriv/389682,99183294621302061
Logan River :,"Plan of allotments to be sold by auction on Saturday 26th June 1922.;'Being Portions 88 to 93 & 95, 99, 99A, 100, 101 & 105, Parish of Redland.';Cameron Bros., auctioneers; H.T. James, lithographer.;Map shows area of what is now Beenleigh - Redland Bay Road near Rocky Passage Road, Redland Bay.;Cameron and Henzell no. 2082QSL",-27.691074,153.305755,http://hdl.handle.net/10462/deriv/420915,99183319798302061
The pride of Coorparoo.,"Plan of allotments to be sold at auction on 16 June 1917.;'Being subs of Portion 211A, Parish of Bulimba';Cameron Bros., auctioneers; H.T. James, lithographer.;Map shows area near Pryde Street Camp Hill.;Cameron and Henzell no. 1996QSL",-27.494307,153.078228,http://hdl.handle.net/10462/deriv/410770,99183316912402061
"Gordon Park, Lutwyche :","Plan of 1063 allotments to be sold 13th Dec. 1890.;'Being portions 7 & 8 & re-sub of sub A of Por. 7, Parish of Kedron.';G.T. Bell, auctioneer; G. K. Jopp, surveyor; Watson, Ferguson & Co., lithographer.;Map shows allotments in the suburb of Gordon Park.;Cameron and Henzell no. 1041QSL",-27.417831,153.025244,http://hdl.handle.net/10462/deriv/411168,99183313408402061
"The Seville Estate, Cavendish Road Coorparoo :","'Re-sub's ... of Portion 192, County of Stanley, Parish of Bulimba.';Plan of allotments to be sold by auction 18th May 1889. Includes terms of sale.;G.T. Bell, auctioneer; C.B. Fletcher, surveyor.;Map shows area of Seville Road and Cavendish Road, now in Holland Park.;Cameron and Henzell no. 821QSL",-27.520306,153.075821,http://hdl.handle.net/10462/deriv/389681,99183294621102061
"Beaconsfield, Humpy Bong :","Plan of allotments for sale. Includes terms of sale.;For sale by J.H. Henzell & Co.; Chas. H. Brittain, surveyor; J.U. McNaught, [litho.];Map shows area of Beaconsfield Street, now in Margate.;Cameron and Henzell no. 489QSL",-27.242696,153.110266,http://hdl.handle.net/10462/deriv/389674,99183294420602061
Burleigh Head North,"Plan of allotments to be sold by auction on Saturday, January 19th, at the Albert Hall.;John Cameron, auctioneer .;""Comprising 278 marine villa sites fronting the Pacific Ocean"" - head of map.;Includes locality sketch map and topographical sketch.;Map surrounded by a border drawn to represent rope.",-28.080439,153.447493,http://hdl.handle.net/10462/deriv/286403,9912541794702061
"Plan of the Addison Estate, Arthur Terrace, Red Hill","Land for sale is subdivisions of portions 791 & 792. Parish of Enoggera.;Includes local sketch.;""To be sold on the ground Saturday Novr 3rd 1888"";Hamilton & Raff, Surveyors.;W. J. Hooker, Auctioneer.",-27.452737,152.997869,http://hdl.handle.net/10462/deriv/282130,9912339224702061
Elwyne Clare Estate.,"Plan of allotments to be sold (undated).;'Re sub of sub 4, port. 10, Toombul' - handwritten on mapQSL;W.H. Harder, surveyor; Isles Love and Co., auctioneers; A. McKinnon, draftsman.;Map shows allotments on Yabba Street and Kitchener Road, opposite Eagle Farm Racecourse in Ascot. '2 minutes from Ascot railway station, 5 minutes from Ascot tram terminus.';Cameron and Henzell no. 1981QSL",-27.426812,153.061711,http://hdl.handle.net/10462/deriv/411146,99183313405402061
"Pilton Estate, Darling Downs, Queensland","Surveyors, J.E. Hamilton, E.J. Matthews, G. Monk.;'To be sold at public auction ... Clifton, 9th February 1910 ... Dalgety & Co. Ltd., Moreheads Ltd., agents in conjunction';'Situated on the main railway line between Sydney and Brisbane and adjacent to Clifton, Nobby and Greenmount.';Includes inset: Local sketch (Location map)",-27.871946,152.03965,http://hdl.handle.net/10462/deriv/286405,9914850754702061
Township of King's Creek.,"Hand-drawn plan of allotments in 'Township of King's Creek'. The map shows a railway line 'S & W Railway Line' (possibly the Southern and Western Railway), King's Creek railway station, King's Creek, unnamed roads as well as allotments in 11 numbered sections. Some sections are coloured in blue and the map has a note 'Company's allots. blue'.;The location is possibly near the road between Clifton and Nobby on the Darling Downs where the road crosses Kings Creek. The road runs beside the railway line.;Cameron and Henzell no. 1984QSL",-27.895966,151.910577,http://hdl.handle.net/10462/deriv/411157,99183313404002061
Ascot Railway Estate,"""To be sold by public auction on the ground Saturday May 24th 1913 at 3 o'clock in the afternoon"";Charlton, Elliott & Co., auctioneers.;R. A. McInnis, suth. surveyor.",-27.358824,153.041385,http://hdl.handle.net/10462/deriv/282134,9912339664702061
Ballantyne Estate :,"Plan of allotments to be sold June 21st [1884].;John W. Todd, auctioneer; McKellar Litho.;Map shows area near Susan Street, Thomas Street, Bramble Terrace and Kennedy Terrace in Red Hill, Brisbane.;Cameron and Henzell no. 475QSL",-27.455053,152.998906,http://hdl.handle.net/10462/deriv/389763,99183294020502061
Campbelltown,"Includes information about the land and surrounded areas.;""A new township fronting to the main Humpy-Bong Road, and adjoining the Ellensvale Estate ... 1/2 miles from the beach in Deception Bay"";Includes sketch map on verso.",-27.211678,153.01334,http://hdl.handle.net/10462/deriv/comp/3783,9912339594702061
Brookfield Fruit Farms Estate.,"Plan of allotments to be sold.;At head of title: For private sale.;T.O'Connor, surveyor; W.R. Moon, land & estate agent; Yates & Jones, draftsmen.;Map shows an area of Brookfield or Pullenvale, near Moggill Creek and Moggill Road. Possibly near where Rafting Ground Road meets Moggill Road.;Cameron and Henzell no. 1985QSL",-27.515708,152.924463,http://hdl.handle.net/10462/deriv/411135,99183313403502061
"Yerong Estate, adjoining Yeronga station.","At base of title: 180 superior allotments.;Plan of allotments to be sold July 5th, [1884]. Map includes terms of sale.;Simon Fraser & Son, auctioneers; McKellar Litho.; Hamilton & Raff, surveyors.;Map shows area near Yeronga train station, between Fairfield Road and Yeronga State School.;Cameron and Henzell no. 474QSL",-27.519326,153.017771,http://hdl.handle.net/10462/deriv/389718,99183294021002061
The Overell Estate :,"Plan of allotments to be sold by auction on Saturday 12th November 1921.;'Being Sub 1 & 2 of ReSub 2 of Sub B and Resub 2 of Subs 61/63 of Allot 10 & Subs 117/118 of s.A. 21 of Portion 1 and Subs 60A of Por 429A Toombul.';Isles, Love & Co., auctioneers, Harry Raff, surveyor; H.T. James, lithographer.;Map shows allotments along Crescent Road Hamilton.;Cameron and Henzell no. 2085QSL",-27.438218,153.057543,http://hdl.handle.net/10462/deriv/420913,99183319797002061
Burleigh Heads /,"Plan of allotments to be sold by public auction on the ground, Boxing Day, Dec. 26th 1922.;H.T. James, Litho.",-28.090940,153.455985,http://hdl.handle.net/10462/deriv/371576,99183221819902061
"East Wooloongabba, known as Darrach's paddock :","Plan of allotments for sale by auction August 2nd, [1884].;John Cameron, auctioneer; Hamilton & Raff, surveyors; Gordon & Gotch, litho.;Map shows area in East Brisbane, shows Withington Street, Didsbury Street and Stanley Street.;Cameron and Henzell no. 488QSL",-27.488492,153.046797,http://hdl.handle.net/10462/deriv/389676,99183294420802061
Baroona Estate Milton,"Arthur Martin & Co., auctioneers.;Includes local sketch.;Hamilton & Raff, surveyors.",-27.464996,153.002252,http://hdl.handle.net/10462/deriv/282125,9912338954702061
"Coomoola Park, Taringa.","Plan of allotments to be sold by auction Saturday 30th April 1921.;record 'Being Subs 11 to 28 of Sub. Sec: 2, 3 & 4, Parish of Enoggera';Cameron Bros., auctioneers; R.A. Hamilton & James, surveyors; H.T. James, lithographers.;Map shows allotments along Stanley Terrace near intersection of Hillsdon Road Taringa.;Cameron and Henzell no. 2055QSL",-27.488691,152.973064,http://hdl.handle.net/10462/deriv/410761,99183318020402061
"Curragh Bawn, Toowong.","Plan of allotments to be sold by auction on Saturday 29th April 1922.;'Being Subdivisons 1 to 13 of Resub A of Subdivisions 21 to 25 of Portion 23, Parish of Enoggera.';Isles, Love & Co., auctioneers; C.F. Bennett, surveyors; A. McLaren, lithographer.;Map shows allotments along Bennett Street Toowong.;Cameron and Henzell no. 2084QSL",-27.483057,152.994715,http://hdl.handle.net/10462/deriv/420914,99183319797802061
Williams' Nursery Estate,"Plan of allotments for sale on the ground, Saturday 3rd Feb. 1923. Including 22 farmlets and 15 residential blocks.;'H.T. James Lith.';'To cotton growers, poultry raisers, orchardists, strawberry growers ...';Land for sale is subdivisions11 to 37 of resubdivision 2 of uubdivision 2 of portion 19 and 20. Parish of Yeerongpilly.",-27.601017,153.076484,http://hdl.handle.net/10462/deriv/286406,9915593694702061
"Railway Station Estate, Cleveland.","Plan of allotments to be sold 9th September 1889.;'Being subdivisions 1 to 14 of allotments 1, 2 and 3 of Section 24, Town of Cleveland.';Arthur Martin & Co., auctioneers; Gordon & Gotch, litho.;Map shows area bordering Middle, Island and Shore Streets in Cleveland.;Cameron and Henzell no. 931QSL",-27.524857,153.265650,http://hdl.handle.net/10462/deriv/411133,99183312716802061
Greylands 2 :,"Plan of allotments to be sold by auction on 7th December 1918.;'Being subs & Resubs of parts of Pors 39 & 40 Parish of Indooroopilly'.;Isles, Love & Co., auctioneers; H.T. James, lithographer; Harry Raff, surveyor.;Map shows area near Ivy Street Indooroopilly.;Cameron and Henzell no.1994QSL",-27.507470,152.980328,http://hdl.handle.net/10462/deriv/410763,99183316912702061
Caloundra Heads Estate.,"Plan of allotments to be sold by public auction Saturday 20th December 1919.;Cameron Bros. Brisbane, acting in conjunction with E. Bostock & Sons, Ipswich, auctioneers; H.T. James, lithographer; F.R. Bostock, authorised surveyor.;Map shows allotments along Albert Street near King's Beach in Caloundra.;Cameron and Henzell no.1991QSL",-26.801193,153.144940,http://hdl.handle.net/10462/deriv/410765,99183316913902061
North and South Waterford :,"Plan of allotments to be sold April 27, 1885.;'Comprising subdivisions of portions 22 to 26, Parish of Mackenzie ....';John Cameron, auctioneer; Gordon and Gotch, lithographer.;Map shows area now called Waterford West.;Cameron and Henzell no. 2062QSL;Supplement to the Telegraph, Saturday April 18 [1885].;Maps issued on different coloured papers.QSL",-27.699043,153.139479,http://hdl.handle.net/10462/comp/8617,99183318016402061
"Plan of 31 allotments, Belle-Vue Estate, Parish of Toombull, County of Stanley, for sale by J. Barger & Co., George Street",,-27.421772,153.051492,http://hdl.handle.net/10462/deriv/282135,9912339704702061
"Choice allotments Walmsley Street, Kangaroo Point.","'Being subdivisions 1 to 6 of subdivisions 7 to 11 of Portions 68, Parish of Kangaroo Point';Plan of allotments to be sold on the ground on Saturday June 23rd. Includes terms of sale.;Simon Fraser and Son, auctioneers; Hamilton & Raff, surveyors.;Map shows 6 allotments on Walmsley Street.;Cameron and Henzell no. 823QSL",-27.481239,153.034828,http://hdl.handle.net/10462/deriv/398712,99183305520902061
"Plan of second section of the Hennessy Estate, Breakfast Creek","Includes local sketch and alternative terms.;Hamilton & Raff, Surveyors.;Plan includes the first section of the Hennessy Estate.",-27.440474,153.04705,http://hdl.handle.net/10462/deriv/286402,9912377844702061
